{
  "$schema": "./reference/payment-deployments.schema.json",
  "version": "1.4",
  "description": "Solana Splitter v1.4 — Program deployment",
  "schemaVersion": 1,
  "generatedAt": "2026-09-13T00:00:00.000Z",
  "ecosystem": "solana",
  "protocolVersion": "v1.4",
  "source": {
    "repo": "AiFinPay/solana-contract",
    "commit": "e5df8f5436cf646ab495381eee04e0d1a10b4e2f",
    "path": "deployments/splitter_v14/"
  },
  "deployments": [
    {
      "cluster": "mainnet",
      "environment": "prod",
      "testnet": false,
      "status": "disabled",
      "settlementEnabled": false,
      "disabledReason": "Backend Solana receipt verification is not implemented and upgrade authority is not multisig",
      "programId": "So11111111111111111111111111111111111111112",
      "idl": {
        "name": "splitter",
        "version": "1.4.1"
      },
      "sourceArtifact": "deployments/splitter_v14/splitter.mainnet.json"
    }
  ],
  "sourceArtifact": {
    "path": "./splitter/solana/deployments.json",
    "retrievedAt": "2026-09-14"
  }
}
